{
  "objectType": "JournalEntry",
  "objectId": "JRN-0035",
  "kind": "FACT",
  "summary": "Slice P5-M01 COMPLETED: all 8 DEC-0014 gates hold (tasks done, acceptance met, one delivery PR #289, exact-head CI, merged 27191091, main re-verified, evidence recorded, register updated on main 944d4fc5 via PR #290) and DEC-0015 runner verification PASS. TASK-0015/0016/0019 COMPLETED. Runners came back online during the session; all deferred self-hosted checks passed.",
  "author": "MANAGER-01",
  "refs": [
    "PR#289",
    "PR#290",
    "SLICE-0001"
  ],
  "schemaVersion": "1.0",
  "revision": 1,
  "createdAt": "2026-09-25T07:38:12Z",
  "updatedAt": "2026-09-25T07:38:12Z",
  "events": [
    "EVT-001121"
  ]
}
